id,title,cluster,bins
1benfn8,classic classroom toy inspires scientists to build electricity generator | the generator device generated an output of over 100 volts and worked for several days using only 100 ml water as fuel.,1,200
1bev96s,wearable sticker reads even the smallest finger motions. the sensor can aid stroke patients and people with disabilities.,4,200
1bfeigl,world’s largest ai chip with 4 trillion transistors to power supercomputers | the chip also needs 97percent lesser code to train a llm when compared to a gpu.,1,200
1bfetog,woman given a new 3d-printed windpipe in a world-first,2,200
1bg558q,aussie invention predicts power line faults that can cause bushfires,4,200
1bgxloq,a cargo ship’s ‘windwing’ sails saved it up to 12 tons of fuel per day,0,200
1bh51cf,"korean researchers power-shame nvidia with new neural ai chip — claim 625 times less power draw, 41 times smaller",1,200
1bhnzvi,"laser-driven pacemaker guides ailing hearts with light | pv semiconductor tech could find applications in neurostimulation, too",2,200
1bhrrve,a sprayable gel could make minimally invasive surgeries simpler and safer,1,200
1bihhr0,"incorporating a phase-change material into concrete, researchers have created a self-heating material that can melt snow and ice for up to 10 hours without using salt or shovels.",1,200
1bihi90,world's fastest wireless ev charger unlocks 100 kw parking spots,3,200
1biig0z,nvidia has virtually recreated the entire planet — and now it wants to use its digital twin to crack weather forecasting for good,3,200
1bjd042,winged cargo ship saves three tons of fuel per day on first voyage,4,200
1bjwu9s,medics design ai tool to predict side-effects in breast cancer patients,1,200
1bjxu2j,elon musk unveils clip of his first human patient implanted with neuralink brain-chip using 'telepathy' to play chess on computer,1,200
1bk4nut,an ai robot is spotting sick tulips to slow the spread of disease through dutch bulb fields,1,200
1bk8kls,"texas firm tops tesla with innovative solar rooftop solution | using lfp batteries, yotta energy has eliminated the need to install a separate battery pack and the extra wiring that it needs.",1,200
1bkyd2t,this stretchy electronic material hardens upon impact just like “oobleck”,4,200
1blhyax,exosuit muscle control steps closer to reality. brain-guided muscle stimulation finds relief with electronic clutch system.,4,200
1blr3s7,the next generation of drugs could be made in space. here’s why,3,200
1bmkkmw,pacemaker powered by light eliminates need for batteries and allows the heart to function more naturally. scientists have designed a solar panel-like pacemaker that can precisely control heartbeats.,4,200
1bmkn8d,molecular weaving makes polymer composites stronger without compromising function,4,200
1bmkx43,mind-blowing science: ‘star wars-style’ holograms to communicate with the brain,4,200
1bne975,doctors take another step toward animal-to-human organ transplants with the first pig kidney transplant. the experimental procedure was done on a man experiencing end-stage kidney failure last week who had been on the transplant waiting list for two years.,0,200
1bnub66,"scientists reveal new flow battery tech based on common chemical | at the center of the design is a lab-scale, iron-based flow battery with unparalleled cycling stability.",1,200
1bnxqlk,"speaking without vocal cords, thanks to a new ai-assisted wearable device",1,200
1bo4wxn,"this drug-delivering contact lens will heal corneal wounds faster | “the more injured you are, the more drug gets delivered, which is unique and potentially a game changer.”",0,200
1bp1tgn,swiss hydrogen-powered train sets 1741-mile record for nonstop travel | the record attempt took place over 46 hours at a test track in colorado where stadler’s hydrogen-powered train is being tested.,2,200
1bp21ej,"silicon spikes take out 96% of virus particles. an international research team led by rmit university has designed and manufactured a virus-killing surface that could help control disease spread in hospitals, labs and other high-risk environments.",4,200
1bplkua,"ai chatbots are beating moore's law to improve at an even faster rate than computer chips | after eight months, a model only needs half the computing power to hit the same benchmark score",1,200
1bpvigl,cern to supercharge world’s most powerful atom smasher to hunt new physics | team to construct vital detector parts and analysis tools for high-luminosity-lhc upgrade.,4,200
1bq81ml,"scientists devise healthy mouse pups from two dads, without female dna | the application is expected to take a long time in humans, maybe 10 years or more and it is unknown whether the eggs are safe enough to produce (a) baby with two male dna.",4,200
1bqb545,blazing bits transmitted 4.5 million times faster than broadband,0,200
1bqozic,engineers find a new way to convert carbon dioxide into useful products,1,200
1brj2z8,will liquid circuits enable brain-imitating computers? new microchips shuffle around ions like synapses in the human brain.,1,200
1bs8o8x,"new tech promises instant paper-based glucose monitoring for under 15 cents | the device, affordable, and eco-friendly, uses a paper-based technology that can be connected to a smartphone app for instant glucose detection.",1,200
1bt0hcg,"seeing with sound: new tech lets blind people ‘hear’ solar eclipse | millions are gearing up to witness the rare and unique total solar eclipse on monday, april 8.",1,200
1bt6ae5,brain-cell transplants are the newest experimental epilepsy treatment,0,200
1btvv12,"using a cellphone’s built-in compass to measure glucose, toxins and more | the compass in your cellphone could also be used to accurately measure the concentration of glucose and environmental toxins.",2,200
1btvz8c,blink to generate power for smart contact lenses | a dual-mode power pack harvests energy from light and from tears,1,200
1btz8g0,"this handheld device allows blind people to experience the solar eclipse with their ears. the technology, which translates the intensity of sunlight into a range of sounds, was designed to make eclipses more accessible to visually impaired people.",1,200
1btzf1n,"scientists break brain disability barrier with thought-controlled interface | the system aids in enhancing neural plasticity, empowering the brain to adapt, grow, and reorganize, fostering continual development over time.",1,200
1buguuc,thousands with type 1 diabetes in england to receive 'artificial pancreas',0,200
1bv1t3w,"innovative sand battery can heat entire town for a week | water batteries, and now sand batteries",1,200
1bv25ra,a new computational technique could make it easier to engineer useful proteins,1,200
1bvc6f0,"opera is testing letting you download llms for local use, a first for a major browser",1,200
1bvc9tb,waymo self-driving cars are delivering uber eats orders for first time,4,200
1bve6yf,"‘the machine did it coldly’: israel used ai to identify 37,000 hamas targets",3,200
1bvmjt8,this virtual second skin is allowing ‘touch’ for isolated sick children | the smart textile made of silicon is as thin as a film and shows how powerful “sensitive” can get.,4,200
1bvnpjp,"gene-engineered bacteria grows plastic-free, self-dyeing vegan leather | for the first time, scientists genetically engineered bacteria to produce vegan leather, which also has self-dyeing properties.",3,200
1bvo7uk,the best robot to search for life could look like a snake,1,200
1bwekcu,"new window film drops temperature by 45 °f, slashes energy consumption | assisted by quantum physics and machine learning, researchers have developed a transparent window coating that lets in visible light but blocks heat-producing uv and infrared.",1,200
1bwkn5c,world's largest digital astronomy camera ready to solve cosmic mysteries,3,200
1bwvfpb,crafty quadcopter can operate indefinitely by recharging on power lines,4,200
1bx99h7,"researchers develop paper battery that generates power from water, air | researchers at tohoku university have developed a paper-based magnesium-air battery that is eco-friendly and powerful.",1,200
1by1lgr,game theory research shows ai can evolve into more selfish or cooperative personalities,4,200
1byurwp,these electronic textiles don’t need chips or batteries | soft fibers light up and send wireless signals at the touch of a finger,4,200
1bz05uw,"‘time is running out’: can a future of undetectable deepfakes be avoided? | tell-tale signs of generative ai images are disappearing as the technology improves, and experts are scrambling for new methods to counter disinformation",1,200
1bz8ex5,"using tissue engineering techniques & a 3d printer, researchers have assembled a replica of an adult human ear that looks & feels natural. this offers the promise of grafts with well-defined anatomy & the correct biomechanical properties for those who are born with a congenital malformation.",4,200
1bzr3sc,"dual layer, 3d magnetic recording to boost seagate’s hdd storage to 120tb+ | the approach could potentially increase data storage capacity ten times to 10 tbit per square inch providing relief to data centers.",0,200
1c021qk,better biosensors just need a touch of cheap plastic. diluting organic semiconductors with polystyrene improves performance.,4,200
1c02g0p,mit engineers craft spring device to enhance robotic muscles | this new flexure functions as a skeleton-like module to boost muscle performance in robots.,1,200
1c0ih0f,"tiny tech consumes 10,000x less power to measure qubits in single shot | the device with a microscopic footprint consumes 10,000 times less power to measure qubits and gives noise-free readouts in a single shot.",1,200
1c0m7nx,the us air force is testing a self-flying f-16 fighter jet — and is sending its boss up as a passenger,4,200
1c0oc72,"scientists use laser light to achieve quantum states at room temperature, a first | the team used a “corkscrew” shaped polarized laser light source.",1,200
1c1brte,northrop grumman introduces its first completed prototype manta ray uncrewed underwater vehicle that it is developing for darpa | the extra-large submarine glider is designed to carry out long-range undersea missions without human assistance.,2,200
1c1btc7,robot uprising? openai and meta to release ais capable of reasoning,4,200
1c287d8,muscle tissue harvested from mice cells move ‘biohybrid’ robots,1,200
1c31igd,pogo stick microcopter bounces off floors and walls,0,200
1c33uyt,how new tech is making geothermal energy a more versatile power source. geothermal has moved beyond being confined to areas with volcanic activity.,1,200
1c3wnye,ai-powered ‘sonar’ on smartglasses tracks gaze and facial expressions,0,200
1c4j1wu,"pea-sized, battery-free brain implant could cure neurological disorders | researchers have created a unique brain stimulator called digitally programmable over-brain therapeutic (dot).",1,200
1c4laty,world’s 1st 60 ghz mmwave to pave way for ultrafast 6g communication | the antenna is built with metamaterials- materials engineered to possess special abilities that they do not have in their natural form.,3,200
1c4nbh0,the tiny ultrabright laser that can melt steel. photonic crystals are the key to the brightest semiconductor laser ever.,0,200
1c4vmht,world first energy storage unit demonstrates zero degradation over 5 years,1,200
1c5w9ax,metal waste catalyst forges way to hydrogen production from water | a new method aims to deliver ‘the most promising green pathways for hydrogen production’ via electrolysis of water.,1,200
1c66ppt,"‘world’s 1st’ paintball firing security cam offers teargas pellet upgrade | it’s the world’s first smart paintball security system and the device will create a new standard in active protection at home, the company claims.",1,200
1c68uga,this hopping robot with flailing legs could explore asteroids in the future,1,200
1c6bicv,"boston dynamics’ atlas humanoid robot goes electric | a day after retiring the hydraulic model, boston dynamics' ceo discusses the company’s commercial humanoid ambitions",4,200
1c6mhaz,"“nanostitches” enable lighter and tougher composite materials. in research that may lead to next-generation airplanes and spacecraft, mit engineers used carbon nanotubes to prevent cracking in multilayered composites.",0,200
1c72gws,breakthrough co2-fueled generator turns greenhouse gas into electricity | researchers claim that they were able to capture approximately 1 percent of the inherent energy contained within co2 gas.,4,200
1c7tpak,us conducts world’s first ai-driven vs. human-piloted f-16 dogfight,1,200
1c8i8e2,microsoft’s vasa-1 can deepfake a person with one photo and one audio track,0,200
1c8ou5z,corkscrew polarized infrared laser light induces magnetism in strontium titanate at room temperature,0,200
1c8wih9,"led touchscreen is also a pv charger. perovskite display tech can read fingerprints and gather health data, too.",4,200
1c91sv8,home assistant’s next era begins now,0,200
1c9ikcc,"this electrode material allows 33x more energy storage in wearables | modified carbon nanotube fiber excels with 33x energy storage, 3.3x strength, and 1.3x conductivity over regular fibers.",2,200
1cada73,"meet qdel, the backlight-less display tech that could replace oled in premium tvs",1,200
1cafhyg,hydrogen trains could revolutionize how americans get around,1,200
1carkhm,"400,000 ‘solar balconies’ boost german home energy harvesting capacity | the solar balcony generates only a tenth of the power output of a rooftop solution, but it is portable if the homeowner wishes to relocate.",1,200
1cb0qek,"gpt-4 can exploit zero-day security vulnerabilities all by itself, a new study finds",3,200
1cb3cvg,"world’s only quantum-gas microscope imaging strontium’s individual atoms | researchers confirmed that strontium gas is a superfluid, lacking viscosity—a key quantum phase of matter.",1,200
1cb6byr,curving terahertz signals around obstacles for 6g | the first curved thz data link could boost faster data networks beyond 5g,2,200
1cblslb,"mit's powerful chip offers ai boost, defense against data breach | this new chip will adopt a three-part approach to protect ai devices from data attacks.",1,200
1cbtdgx,mit study reveals ai model that can predict future actions of human,1,200
1cc6xec,"plato's final resting place revealed using 'bionic eye' | with new technology, researchers decipher 1000 words from the herculaneum papyri that includes details about plato’s final resting place.",1,200
1ccn78t,an ai startup made a hyperrealistic deepfake of me that’s so good it’s scary | synthesia's new technology is impressive but raises big questions about a world where we increasingly can’t tell what’s real,2,200
1ccrar5,opencrispr-1: world’s first open-source ai scissor edits human genes | the gene editors developed by profluent are built upon the pioneering techniques recognized with nobel prizes.,1,200
1ccrdrv,tiny biosensor unlocks the secrets of sweat,0,200
1cd7c68,new laser tech using raman spectroscopy detects illegal elephant ivory | non-destructive laser technology swiftly detects illegal elephant ivory.,1,200
1cdk79c,a new kind of gene-edited pig kidney was just transplanted into a person,3,200
1ceeasd,energy-smart bricks keep waste out of landfill,0,200
1ceqzra,darpa unleashes 20-foot autonomous robo-tank with glowing green eyes | it rolls through rough terrain like it's asphalt,0,200
1cf45oh,"world's biggest 3d printer whirs into action. it's hoped giant device will be able to print homes, bridges, boats and wind turbines.",4,200
1cff67b,ukraine is riddled with land mines. drones and ai can help,4,200
1cg5lds,solar fuel production just needs a change in direction photoelectrodes that move electric charge diagonally split water better,1,200
1cg8x3p,nasa uses laser link to beam data 140 million miles across space at 25 mbps,3,200
1cgozvz,bacterial enzyme strips away blood types to create universal donor blood,1,200
1chi7pu,miniature robotic bees navigate swarm flight autonomously,0,200
1chjjkd,"meet stickbug, the new six-arm pollinating bot living in greenhouses | stickbug, a multi-agent robot aims to address the decline in natural pollinators by autonomously transferring pollen to specific types of flowers.",2,200
1chn1bo,agricultural iot system sends power through the soil | tennessee field trials powers sensors for just pennies per day,4,200
1cice6g,darpa’s massive manta ray robotic sub hits the sea,0,200
1cigw4o,"sea turtle ears inspire a new heart monitor design | the device ""listens"" by detecting tiny vibrations in a beam sensor",4,200
1ciut8o,stretchable e-skin could give robots human-level touch sensitivity,1,200
1cj7l2q,this biometric dog collar could help in predicting earthquakes | the petpace biometric collar monitors a dog’s stress levels which might help us understand that an earthquake is coming.,2,200
1cj8crn,these recyclable circuit boards could stem e-waste. vitrimer-based pcbs can be broken down into a gel for repeated reuse.,4,200
1cja554,"transparent filter with 10,000-pixel power turns phone into pro camera | the study utilizes a transparent, one-centimeter-square plane featuring a 2d semiconductor—a thin film composed of only a few atoms.",0,200
1cjo3yu,copper coating turns touchscreens into bacteria killers,0,200
1cjue1p,an ai-controlled fighter jet took the air force leader for a historic ride. what that means for war,0,200
1ck56c3,"smart antennas shape satellite internet tech to come. metasurface arrays will portably link up base stations, cars, and drones.",3,200
1ckawq1,"researchers develop new device modeled on leeches for taking blood samples using microneedles and a suction cup instead of a large needle. it is low cost, helps people with needle phobia, reduces risk of needlestick injuries and can be used by people without medical training.",1,200
1ckcqzz,new technique improves t cell-based immunotherapies for solid tumors,4,200
1ckd5nn,"nasa’s orion capsule heat shield wore away in more than 100 places during 2022 test flight, posing ‘significant risks’ a new report highlights safety issues that nasa must address before using the spacecraft to send astronauts to the moon, and the agency is already working on fixing the problems.",4,200
1ckqtmo,"china’s water battery has almost double energy capacity than lithium cells | aqueous batteries use water as the solvent for electrolytes, enhancing the safety of the batteries.",1,200
1cldn2a,"generative ai will be designing new drugs all on its own in the near future | within a few years, experts at lilly and nvidia say ai will not only think up new drugs, but ones that humans could not create",1,200
1clg5d8,"""video games"" for flies shed light on how they fly | biologists went to great lengths to study insects' complex wing structures",0,200
1clibbi,deep-space lasers smash data speed records over interplanetary distances,0,200
1clm0lh,scientists are trying to get cows pregnant with synthetic embryos,1,200
1clrpxn,the invisible seafaring industry that keeps the internet afloat,0,200
1clxwk8,nanotechnology-based oral insulin may replace injections for diabetes  | it consists of a “nano-carrier” that precisely delivers insulin molecules inside the body.,0,200
1cm1r7r,"40,000 ai-narrated audiobooks flood audible, dividing authors and listeners | ai audiobooks have invited backlash from narrators",3,200
1cmcmyt,sound waves cut cold brew coffee-making time from 24 hours to 3 mins | researchers have developed an ultrasonic machine to speed up the cold brew of ground coffee beans.,3,200
1cmxyj5,raspberry pis get a built-in remote access tool: raspberry pi connect,2,200
1cn25vj,"high-speed military amphibian skims the waves using surface effect | textron is developing a remarkable new surface effect amphibious transport for the us navy and marines. it can carry 50 tons of cargo, skims the waves at 50+ knots, and operates in water just four feet deep.",2,200
1cn2v4h,this sound-suppressing silk can create quiet spaces,0,200
1cnkbfi,"engineers develop ‘wraparound’ device for spinal cord treatment | this approach inspired by microelectronics involves wrapping very thin, high-resolution implants around the whole spinal cord.",4,200
1cnmn0j,robot dogs armed with ai-targeting rifles undergo us marines special ops evaluation,1,200
1co2z9e,femtosecond lasers solve solar panels' recycling issue,4,200
1coco0a,"scientists unlock key to cheap hydrogen fuel with 95% less iridium | this new discovery dramatically reduces the need for a rare, expensive metal currently used in hydrogen fuel production.",2,200
1covgos,2d gold sheet draws graphene comparisons. applications expected in water-to-hydrogen tech and efficient electronics.,4,200
1cox4et,"smart contact lens to wirelessly detect irreversible vision loss early | the contact lens can provide real-time monitoring of eye pressure, which is crucial for conditions like glaucoma.",0,200
1cp79vm,"is ai lying to me? scientists warn of growing capacity for deception | researchers find instances of systems double-crossing opponents, bluffing, pretending to be human and modifying behaviour in tests",1,200
1cp7x63,bumble founder shares odd future of dating: your ai dates my ai,1,200
1cpg8s3,"using mri, engineers have found a way to detect light deep in the brain. the new technique could enable detailed studies of how brain cells develop and communicate with each other.",1,200
1cpljhz,making batteries takes lots of lithium: almost half of it could come from pennsylvania wastewater,1,200
1cps031,"red, yellow, green ... and white? smarter vehicles could mean big changes for the traffic light",4,200
1cq7ajl,university students in hawaii use cutting-edge technology to digitally restore historic buildings damaged by maui wildfires. a new course at university of hawaii at manoa has enrollees design digital twins of notable structures so that people can experience them virtually.,1,200
1cqvnsn,world's highest-efficiency hydrogen system scales up for mass production,2,200
1cqywcc,"scientists use bamboo to create transparent glass with fireproof power | with a transmittance of 71.6 percent, the transparent material increased energy conversion by 15 percent when employed in solar cells.",1,200
1crho12,"openai’s newest ai model can hold a humanlike conversation | gpt-4o can see, hear and speak with near-instant response times.",3,200
1crrt0k,startup sends bluetooth into low earth orbit. hubble network and life360 aim to launch a worldwide item-tracking network.,0,200
1crsjrv,revolutionary ai device mimics human brain with few-molecule computing,1,200
1cs3sy3,scientists develop an affordable sensor for lead contamination,4,200
1csfy67,"in seawater, researchers see an untapped bounty of critical metals",4,200
1cshtwv,this microcapacitor charges 100 million times faster than lithium-ion batteries | a materials tweak could push microcapacitors onto next-gen chips,4,200
1csikm8,"power the poor: sweden makes low-cost zinc battery with 8,000 charging cycles | the battery is made from abundantly available materials and retains 80 percent of its performance over the course of 8,000 cycles.",4,200
1csj6cj,robotic “superlimbs” could help moonwalkers recover from falls,2,200
1ct0nr1,"new neural tech could power insect-sized intelligent flying robots | the system uses a five-layer spiking neural network with 28,800 neurons to analyze raw event-based camera data and estimate the camera’s 3d motion.",1,200
1cta8fz,"""snake-like"" probe images arteries from within | the new fiber-optic probe could transform aneurysm and brain clot treatments",1,200
1ctiduo,super-efficient solar cells: solar cells that combine traditional silicon with cutting-edge perovskites,1,200
1cu2bzk,quantum internet inches closer: qubits sent 22 miles via fiber optic cable | three research labs in three different countries have found different ways to make the quantum internet possible.,3,200
1cuuej4,uk builds world’s smallest light detector to shrink quantum computers | the detector is not just the world’s smallest but also 10 times faster than detectors previously built for quantum light detection.,1,200
1cve5k6,5 things to know about nasa’s tiny twin polar satellites,0,200
1cvf8dm,repurposed beer yeast may offer a cost-effective way to remove lead from water,1,200
1cvgr9s,china’s first large-scale sodium-ion battery charges to 90% in 12 minutes,1,200
1cvo54b,patagonia is cracking the code on endlessly recyclable wetsuits. the outdoor apparel retailer will start selling wetsuits made in part from used wetsuits deconstructed at a molecular level and reborn as new fabric.,4,200
1cvppq0,"researchers achieve giant energy storage, power density on a microchip",1,200
1cw3q89,"the supermarket scanner changed the way we buy groceries forever. invented 50 years ago, the curious box deciphered an arcane kind of code to offer shoppers a trip into the future.",2,200
1cwftp6,"mad scientists build ""dune""-inspired stillsuit that can recycle sweat",2,200
1cwfx1m,green concrete recycling twice the coal ash is built to last,4,200
1cwjaf7,real-life 'stillsuit' recycles body fluids into drinkable water,4,200
1cwq0l6,"world’s first drone-shepherd successfully steers cattle herd remotely | the program includes a docking station housing a drone that can land, recharge, and take off based on its preset schedule.",2,200
1cws43o,single brain implant gives paralyzed man bilingual communication,1,200
1cwyr24,"new windows ai feature records everything you’ve done on your pc | recall uses ai features ""to take images of your active screen every few seconds.""",1,200
1cxazt6,"ai is a black box. anthropic figured out a way to look inside | what goes on in artificial neural networks work is largely a mystery, even to their creators. but researchers from anthropic have caught a glimpse.",1,200
