id,title,cluster,bins
1cxb6gz,crushing it: autonomous ai robot creates a shock-absorbing shape no human ever could,1,200
1cxccqe,"robotic palm mimics human touch. mit csail researchers enhance robotic precision with sophisticated tactile sensors in the palm and agile fingers, setting the stage for improvements in human-robot interaction and prosthetic technology.",4,200
1cxnh5w,"copper-coated steel promises 90% bacterial elimination from surfaces | scientists developed a copper-coated nanotextured stainless steel (nss) surface to prevent bacterial infections, effective in most shared environments.",0,200
1cxu1fl,you can now buy a 4-foot-tall humanoid robot for $16k,2,200
1cxzbql,a device that zaps the spinal cord gave paralyzed people better control of their hands,1,200
1cxzh9h,scientists grow diamonds from scratch in 15 minutes thanks to groundbreaking new process,1,200
1cxzitn,"making steel with electricity. mit spinout boston metal is commercializing a new method for making steel and other metals, to help clean up the emissions-intensive industry.",2,200
1cywl4s,'absolute miracle' breakthrough provides recipe for zero-carbon cement,4,200
1cz5n2q,'bio-paper' implant: personalized wireless electrotherapy for parkinson's,0,200
1czim1g,"scientists print invisible, spider silk-like sensors directly on skin | the fibres used in these sensors are at least 50 times thinner than a human hair.",2,200
1czj6ta,"new warp drive concept does twist space, doesn’t move us very fast. while it won't make a useful spaceship engine, it may tell us more about relativity.",1,200
1czkbwm,male birth control breakthrough safely switches off fit sperm for a while,4,200
1d0123c,"new ‘invisible tweezers’ can make robot surgery non-invasive | the method uses acoustic emitters to create 3d vortex fields, acting like invisible tweezers to traverse bone and tissue.",1,200
1d0jo4o,"2 teens won $50,000 for inventing a device that can filter toxic microplastics from water",1,200
1d0kihg,"new tool blocks high-frequency signal interference, aids 6g tech | the adjustable filter is designed to prevent signals from causing interference, even in higher-frequency bands. the quarter-sized filter will unlock the next generation of wireless communications.",4,200
1d142j3,"organic waste can't be added directly to concrete because it would decompose over time and weaken the building material. to overcome this challenge, researchers developed a technique to make concrete 30% stronger using coffee biochar made with a low-energy process without oxygen.",1,200
1d1vuqe,"noise-canceling headphones use ai to let a single voice through. they could help wearers focus on specific voices in noisy environments, such as a friend in a crowd or a tour guide amid the urban hubbub.",1,200
1d22f56,three new supercomputers reach top of green500 list. efficiency ratings matter more and more in the exascale age.,3,200
1d2flj7,darpa intends to wirelessly charge drones while in flight by power-beaming,0,200
1d2z84j,"neuralink rival sets brain-chip record with 4,096 electrodes on human brain | precision expects its minimally invasive brain implant to hit the market next year.",1,200
1d3avu4,attosecond x-ray pulses reveal the dance of electrons,0,200
1d3cmqn,scientists create new color-changing ‘sunglasses for windows’ to block heat | once activated the color changing film can retain the color for 40 hours unless a reverse potential is applied to make it transparent.,3,200
1d3q527,world-first tooth-regrowing drug will be given to humans in september,0,200
1d43v1n,"robotic ‘third thumb’ expands hand’s range of motion, carrying capacity | study showed, 98 percent of participants successfully manipulated objects with the third thumb, with only 13 unable to perform the task within the first minute.",0,200
1d4su6x,australian firm cryogenically freezes man after death in hopes of revival | an australian man underwent the first successful cryonics suspension via southern cryonics and cryopath tech.,2,200
1d5k01h,"world’s fastest vision chip for autonomous cars created in china is capable of sensing 10,000 frames per second.",4,200
1d5vh9l,this lens is just three atoms thick and works like a quantum lighthouse. the tiniest fresnel lens may be perfect for augmented reality glasses.,4,200
1d6dpqe,"what to know about world's first wooden satellite, set to launch this year",1,200
1d6hz8u,"researchers hope that the world's first ""living processor"" will lead to energy-efficient computing power | online platform gives researchers remote access to 16 human brain organoids",1,200
1d70v8n,"1x's eve humanoid robot masters task chaining, nears autonomous work",4,200
1d73p56,synthetic plugs could reduce need for total knee replacements | an off-the-shelf surgical device could treat osteochondral defects and avoid total knee replacement.,2,200
1d740pi,ai-directed drones could help find lost hikers faster,2,200
1d7ot9u,can 'energy hog' hot tubs be made greener?,4,200
1d7u7yy,night-vision lenses so thin and light that we can all see in the dark,0,200
1d8my1g,stretchy displays sport better resolution | ultrathin oleds still shine when stretched,4,200
1d8p8wq,"this system converts air to water using atmospheric water generators that contain a liquid desiccant. using the sun or renewable electricity they heat the desiccant to 65c which releases the moisture, and can be condensed into drinking water. each unit produces about 2,000 litres of drinking water.",1,200
1d8qtmj,zoom ceo eric yuan wants ai clones in meetings | eric yuan wants to let your ai-powered ‘digital twins’ attend meetings for you.,0,200
1d8r1e7,"asana’s new “ai teammate” can tell people what to do at work | instead of just showing who has been assigned what task, now asana says its ai tool can do the assigning or reach out to fill in missing information.",1,200
1d8s5a9,‘dumb drones’ get smart: world’s 1st navigation tech to let uavs fly blind | these circuits are ten times more precise than the micro-electro-mechanical systems inertial measurement units typically used in commercial applications.,3,200
1d9i1fa,"world’s first 3d e-skin gives robots human-like touching sense | this electronic skin from china can decode pressure, friction, and strain in real time",1,200
1d9j2a1,hybrid bonding plays starring role in 3d chips. tech makes millions of connections in a square millimeter of silicon.,4,200
1d9s9lj,"new water-based heat pump delivers 400% more heat than the energy it uses | seawarm’s heat pump can harness energy from any water body, offering a more sustainable solution for powering homes and businesses.",1,200
1db32mo,climeworks captures double the co2 for half the energy. the world’s first megaton carbon capture site will join a growing field.,1,200
1dbz1oy,"stanford's computational imaging lab designed a way to project moving, ai-generated 3d images on what appear to be standard lenses. the breakthrough centers on what the team calls a nanophotonic metasurface waveguide (a waveguide essentially being a piece of glass).",2,200
1dbz36h,"researchers demonstrate the first chip-based 3d printer. smaller than a coin, this optical device could enable rapid prototyping on the go.",1,200
1dbzfnq,"spiderwebs can pick up vibrations in air flow caused by sound waves, and researchers say microphones designed this way could become more sensitive and compact.",1,200
1dchyyt,fast-charging sodium-ion battery uses anodes made from trees,1,200
1dcipwm,"swiss scientists shrink super laser on a small chip in a world-first | miniaturized lasers are more cost effective to produce, portable and could power increasing number of applications in the future.",2,200
1dcmj4h,digital twins are helping scientists run the world’s most complex experiments,1,200
1dcxisr,"researchers developed a programmable metafluid with tunable springiness, optical properties, viscosity & can transition between a newtonian & non-newtonian fluid. the metafluid uses a suspension of small, elastomer spheres that buckle under pressure, radically changing the fluid's characteristics.",2,200
1dcxlsv,"new water-based heat pump delivers 400% more heat than the energy it uses | seawarm’s heat pump can harness energy from any water body, offering a more sustainable solution for powering homes and businesses.",1,200
1ddazv1,"researchers have created a tiny chip that can take images of objects through cardboard | the technology, designed to fit inside a smartphone, brings us a step closer to wielding superman’s x-ray vision abilities (without the x-rays).",1,200
1dde5m4,the cement that could turn your house into a giant battery,1,200
1ddex9z,"soft robot transformers bend, expand, twist to deliver meds inside body | robots for bladder control, blood flow measurement, stomach monitoring, and heart sensing and stimulation.",1,200
1de5tqh,indian startup 3d prints rocket engine in just 72 hours,0,200
1de80cn,"seashell-inspired cement is super stretchy, crack-resistant, unbreakable | the new material is 19x more flexible, stretches without breaking, and 17x more crack-resistant than regular cement.",1,200
1de8l6i,smart powerline “neurons” boost grid capacity | sensor networks enable 40 percent more electricity to pulse through the lines,0,200
1dew2p4,"‘liquid battery’: scientists discover way to store electricity in liquid fuel | the ‘liquid battery’ stores excess renewable energy as isopropanol, a liquid alcohol that serves as a high-density hydrogen carrier.",1,200
1dfpy60,a 3d-printed engine by an indian startup takes rocket four miles into the sky | it's the world's first rocket engine to be 3d-printed in a single piece,1,200
1dfwdir,this engineer’s solar panels are breaking efficiency records. yifeng chen has been at the helm of dozens of photovoltaic advances.,3,200
1dgbsc4,seattle entrepreneurs are building autonomous robots to deliver hassle-free ev charging,4,200
1dgft6y,biotech companies are trying to make milk without cows,1,200
1dgixti,giant chips give supercomputers a run for their money. cerebras’s wafer-scale chips excel at molecular dynamics and ai inference.,2,200
1dh742n,"purified silicon makes bigger, faster quantum computers. pushing out impurities from wafers points toward a million-qubit future.",4,200
1dhcyoj,"mit's portable fingernail scanner can reduce cancer hospitalization by 50% | pointcheck, a portable fingernail scanner, empowers patients to track their white blood cell levels and detect early signs of infection.",4,200
1dhwqvj,"scientists preserve dna in an amber-like polymer. with their “t-rex” method, dna embedded in the polymer could be used for long-term storage of genomes or digital data such as photos and music.",4,200
1dhxmhz,"wireless chipset clocks 640 gbps transmission speed, 100x faster than 5g | the 65nm architecture used to fabricate the chip allows for large scale production at low costs.",0,200
1dia7wx,tdk claims insane energy density in solid-state battery breakthrough. apple supplier says new tech has 100 times the capacity of its current batteries.,1,200
1diebbi,tdk unveils prototype solid-state battery with 20 times the energy density of closest competitor | these tiny wafer batteries could power small devices like the apple watch in just a couple of years,1,200
1dinfab,superman-inspired chip brings x-ray vision to regular smartphones,0,200
1diqyf4,satellites can help detect early warning signs weeks before earthquakes | anomalies in the lithosphere and ionosphere can be detected days in advance,0,200
1djkh9i,"a clean, green way to recycle solar panels. see how this italian startup recovers valuable materials without toxic chemicals.",1,200
1dkda8s,"researchers leverage shadows to model 3d scenes, including objects blocked from view. this technique could lead to safer autonomous vehicles, more efficient ar/vr headsets, or faster warehouse robots.",1,200
1dkivme,"for evs, semi-solid-state batteries offer a step forward. chinese automakers are rolling out batteries with gel electrolytes.",4,200
1dl1vck,‘space hairdryer’ uses shockwaves to regenerate heart cells post-surgery | the clinical trial proved shockwave therapy’s ability to regenerate heart tissue as well as improve heart pumping function in patients.,4,200
1dlsqzk,gel sensor uses motion to generate 83% higher voltage than counterparts,4,200
1dm2aw8,"‘glassy gels’ are a new class of strong, stretchy, sticky materials. they're as tough as plastic but five times as elastic.",4,200
1dmj3j5,humanoid robot with highest operational time in tests by us logistics giant,1,200
1dmnn6t,is this the end of animal testing? researchers are increasingly turning to organ-on-a-chip technology for drug testing and other applications.,1,200
1dmwg00,"swallowable robot with thrusters performs endoscopy at home | pillbot lets doctors examine the stomach remotely via a smartphone app, replacing upper endoscopy with minimal patient prep.",4,200
1dnawje,‘living laboratory’: japan’s ‘woven city’ to get 1st residents — toyota,3,200
1dnepmg,german team extracts battery-grade lithium from geothermal water | the new process could provide an alternative to more conventional ‘dirty’ methods of extracting lithium.,3,200
1dngkrd,"designing for outer space. with nasa planning permanent bases in space and on the moon, mit students develop prototypes for habitats far from planet earth.",0,200
1dngvmp,"world’s 1st epilepsy implant cuts seizures by 80%, recharges via headphones | seven months post-operation, oran has been reported to be “more alert and has not experienced any drop seizures during the day.”",0,200
1do2pj3,"first-ever 3d printer that gulps plastic, metal, chips to make layered devices",3,200
1do8olr,human-like skin for humanoids: japan creates new tissue binding tech for robots | researchers found a way to bind skin to complex structures by mimicking skin-ligament structures and using v-shaped perforations.,1,200
1dogv0i,face screening tool detects stroke in seconds,0,200
1dovrug,german firm synhelion opens ‘world’s 1st’ industrial solar fuel plant,3,200
1doy3vq,"us scientists turn dry air into drinking water with 5 times more efficiency | even in desert-like conditions, the fins were saturated with water in about an hour.",1,200
1dp0glg,"scientists move objects with sound, pave way for noninvasive drug delivery | the new sound-based method can move objects regardless of their surroundings or physical properties.",1,200
1dporx1,"rhinos get radioactive horns, will trigger nuclear alarms if poached | witwatersrand university’s initiative could extend to protecting elephants, pangolins, and other endangered species.",1,200
1dpsxfc,"world record-shattering 402 tb data sent in a second via optical fiber | 37.6 thz optical bandwidth achieved by using 6 doped-fiber amplifier variants and raman amplification, covering all low-loss transmission bands of silica fibers.",2,200
1dqghqy,tiny lens that uses light trickery to detect gas created in germany,4,200
1dqj83k,"one of the world's largest engines becomes a clean generator. originally designed to burn diesel, dual-fuel, or gasoline for tankers and container ships, the wärtsilä 31 marine engine gets a new life generating clean, renewable electricity.",4,200
1dr85je,"nasa extends starliner mission for astronauts on iss, insisting ‘they are not stranded in space’",0,200
1drmfye,"world's 1st smart glasses with gpt-4o identify objects, answer queries | solos smart eyewear announces airgo vision, the first glasses to incorporate gpt-4o technology.",3,200
1drpsld,chinese scientists create robot with brain made from human stem cells,1,200
1drzgzq,"record-shattering nyobolt's ev battery charges 10-80% under 5 minutes | this compact and powerful battery, designed for electric vehicles, achieves an 80% charge in a mere four minutes.",4,200
1ds00gf,nuclear microreactor gets unmatched safety with live 3d temperature mapping,2,200
1dsfz4o,wireless receiver blocks interference for better mobile device performance,1,200
1dsq646,invisible assassins: new nanobots detonate hidden weapons to kill cancer,2,200
1dsttfv,researchers craft smiling robot face from living human skin cells,1,200
1dt5fv5,supershoes are reshaping distance running.,0,200
1dtiudd,us builds world’s most accurate atomic clock ever to boost space science | light-based or optical atomic clocks could potentially lose a second in 30 billion years compared to microwave-based clocks.,2,200
1dtiwtz,feel the beat: mit’s brain-powered bionic leg lets amputees dance again,0,200
1dtu8bn,"engine innovation enables portable muscle power for assistive devices | the fluidic engine, with a battery-powered high-torque motor, generates pressure allowing the artificial muscle to exert substantial force.",0,200
1dub0xz,"mit, harvard, columbia scientists create implantable microphones for the deaf",3,200
1duwv3m,"figure’s 01 humanoids now working at bmw’s car plant in us | the humanoid operates autonomously, with actions guided by neural networks mapping pixels to actions.",0,200
1dv4uki,"new tech turns industrial energy waste into drinking water, heat in norway",1,200
1dv5ytc,a polyester-dissolving process could make modern clothing recyclable,1,200
1dv7ai1,mind-reading ai recreates what you're looking at with amazing accuracy,2,200
1dv7ybk,"100-year-old house showcases one of uk's best heat pumps | heat pumps are praised for their potential to reduce global co2 emissions by 500 million metric tons, according to the international energy agency.",3,200
1dvacix,"3d-printed edible qr codes for tailored meals made in singapore | this technology can be applied in creating meals tailored to individual dietary needs, aesthetically pleasing dishes, and interactive food experiences such as edible qr codes.",0,200
1dvns4t,japan introduces enormous humanoid robot to maintain train lines,4,200
1dvuq21,ultimate test’: mit gives probiotic bacteria space-resilient superpower,0,200
1dvv072,fish-friendly fans: us firm’s turbines make hydropower safe for marine life | the us-based firm had built the world’s first fish safe restoration hydro turbine in 2019.,1,200
1dwnhiz,‘rocket suit’ in olympics: nasa-backed design could help swimmers clinch gold,4,200
1dwnt3t,a way to let robots learn by listening will make them more useful,1,200
1dwu2ai,"robogrocery: mit's soft robot packs groceries with record accuracy | rgb-d cameras capture depth and color data, enabling precise identification of objects’ shapes and sizes on the conveyor belt.",3,200
1dxeodw,"400 robotic surgeries, 98% survival rate: saudi hospital achieves milestone",0,200
1dxf0nq,"step aside futurama, scientist build robot that's controlled by a brain in a jar",2,200
1dxowrz,"china's robot dog aids blind people with 90% voice recognition accuracy | the robot guide dog can reach speeds up to 3 m/s, accommodating both slow walking and faster paces. its six-legged structure guarantees stable, quiet motion.",3,200
1dy69lj,ivf breakthrough: 1st-of-its-kind pregnancy pill boosts fertility greatly,3,200
1dy9t2l,world’s first mouse model with fully functional human immune system developed | this new approach may offer a viable alternative to the use of non-human primates in immunological and microbiological research.,1,200
1dyhq3b,"ammo atm? ai-powered bullet vending machines introduced in us | the company, according to its website, also says that its vending machines are as easy to use as an atm.",4,200
1dyzdsz,no finger pricks: tiny laser-loaded band-aid tracks glucose from sweat | the innovative device integrates microlaser technology into a soft hydrogel film for precise biomarker detection in real-time.,4,200
1dz0i8n,new fiber optics tech smashes data rate record. expanded bandwidth yields a transmission rate of 402 terabits per second.,2,200
1dzbjo8,engineers have created a device that can efficiently convert heat into electrical voltage at temperatures lower than that of outer space. the innovation could help overcome a significant obstacle to the advancement of quantum computing technologies.,1,200
1dztlfy,us develops world’s 1st forever-chemical-free battery with 20% more power | the process is free from pfas or forever chemicals and the company claims that it will have competitive pricing with other cobalt-based electrodes.,1,200
1dzueq5,rice-sized warrior: new led device uses light to destroy deep cancers,1,200
1dzveuo,xiaomi's self-optimizing autonomous factory will make 10m+ phones a year,4,200
1e0l7kn,"world’s highest performing quantum chip unveiled by oxford ionics | by using electronics-based qubit control, quantum ionics could bring us quantum computers in a few years.",1,200
1e0mj3o,us: cancer patient’s voice restored with world’s first larynx transplant,1,200
1e0mqxs,ai brain implant restores bilingual communication for stroke survivor,1,200
1e1f9qb,"hydrogen-powered air taxi sets record 523-mile trip, emits just water steam | joby’s hydrogen-electric demonstrator, based on their battery-electric aircraft, holds 88 lbs of liquid hydrogen and fewer batteries, sharing the same airframe.",2,200
1e1tuhd,"artificial foot that mimics human movement to help people with limb loss | this unique foot is motor-free, flexible, and designed for all-weather use.",1,200
1e1ucvp,wave begins delivery of fire-spewing engine with no moving parts,0,200
1e1zznl,reasoning skills of large language models are often overestimated | mit news | massachusetts institute of technology,4,200
1e274dp,"flexible artificial foot mimics human movement, can help people with limb loss",2,200
1e2asbn,"new weightless carbon fiber battery could make cars, planes 50% lighter | this innovative material serves a dual purpose: it acts as both a structural component and a power source, eliminating the need for additional heavy batteries.",1,200
1e2pmrf,silicon days over? new organic solar panel offers increased efficiency | organic semiconductors offer a viable alternative to silicon-based photovoltaic panels at a lower cost and with greater flexibility.,4,200
1e2zdwh,world’s first mobile bricklayer robot that boosts construction speed enters us,1,200
1e3rbrg,scientists finally discover dna key to fight deadly pancreatic cancer,1,200
1e3s9ei,"soft robot can amputate and reattach its own legs | inspired by lizards and ants, this robot can change its shape at will",1,200
1e4ltis,spacesuit prototype turns pee into drinking water | the system is inspired by the stillsuits for collecting moisture in the science fiction epic dune,2,200
1e4lxld,us to test japan’s unique wind turbines that generate power even at 7 mph,1,200
1e4pdgi,"solar panel waste makes ev batteries 99.9% efficient, retain 83.1% capacity | silicon anodes give lithium-ion batteries better energy density and can improve battery performance, even over 200 charge-discharge cycles.",1,200
1e4rvyj,drone sits on power lines to recharge,4,200
1e4znsy,new 'superlubricity' coating is a step toward friction-free machines,4,200
1e5fn4e,paralyzed patient speaks with power of thoughts using brain-computer interface,1,200
1e5htcp,"world’s 1st dual-tower solar plant unveiled, will make 1.8 billion kwh yearly | the 200-meter dual towers have 30,000 mirrors to cover an 800,000-square-meter light-collecting area.",1,200
1e5hyj9,"shapeshifting battery can stretch 5000%, retain charge after 70 cycles | researchers used material used to make contact lenses to make the battery flexible.",1,200
1e5i32x,"new drug reverses diabetes in mice, boosting insulin-making cells by 700% | one day this research could lead to game-changing new treatments for diabetes",1,200
1e619ih,"the smallest, lightest solar-powered drone takes flight | it weighs less than a nickel and can fly nonstop while the sun shines",0,200
1e68rt1,"this ""smart"" soil can water and feed itself | a newly engineered type of soil can capture water out of thin air to keep plants hydrated and manage the release of fertilizer.",2,200
1e68t02,"enzyme-powered “snot bots” help deliver drugs in sticky situations | tiny, enzyme-powered bots can push through mucus, helping to deliver drugs more efficiently.",0,200
1e6dt9o,"robot dog cleans up beaches with foot-mounted vacuums | thanks to vero, genoa has fewer cigarette butts littering the ground",2,200
1e6ivyi,"charge less, power more: zinc-bromine battery tech hits record 10,000 charge cycles",1,200
1e71fmi,‘dolphin skin’ propeller boosts fuel efficiency of cargo ships | a new propeller coated with a skin mimicking that of a dolphin holds the promise of significantly reducing fuel consumption and emissions in large cargo ships.,0,200
1e734lu,"horsepower to poop power: horse manure better at generating electricity, heat",1,200
1e7sn01,why bigger may not be better for nuclear energy,1,200
1e8jz5f,"complete recycle of solid-state batteries possible, thanks to polymer layers",2,200
1e8usdd,"new drug extends lifespan by 25%, fights aging, could prevent cancer | researchers administered an injection of an anti-il-11 antibody to 75-week-old mice, neutralizing the harmful effects of il-11.",1,200
1e9a4id,graphene-based brain chip offers 200x more power for parkinson’s patients | inbrain’s graphene chip is a promising new technology with the potential to improve brain surgery and neurological treatments.,1,200
1e9c02n,origami helps implant sensors in bio-printed tissue,0,200
1e9im8v,rolls royce’s 120-inch-long mini space nuclear reactor gets funding boost,4,200
1ea3pen,us scientists create plastic that glows and biodegrades on demand | the secret lies in integrating a special chemical called tert-butyl ester.,3,200
1ea5gwq,sky drift: boeing’s pilotless air taxi could take passenger flight by 2030,4,200
1ea6wai,dog-like robot jams home networks and disables devices during police raids — dhs develops neo robot for walking denial of service attacks | smart home defenses crumble when the neo dog arrives.,4,200
