id,title,cluster,bins
1eaemw3,"new 3d-printed solar steam generators can desalinate, purify seawater | the ssg absorbs sunlight, converts it into thermal energy then uniformly transfers it to water, resulting in its absorption of heat and subsequent evaporation, as per scientists.",1,200
1eayt44,test flight demonstrates navigation by cellphone signals | the new technique could protect against gps spoofing,2,200
1eaz4m1,"breakthrough battery bears 212°f heat, hits 99.8% efficiency after 450 cycles",1,200
1ebqw90,scientific milestone achieves atomic-scale imaging in a world-first | researchers have built a single molecule high resolution quantum sensor that can measure electric and magnetic fields in atoms.,1,200
1ebsnaj,"ai-powered robotic exoskeleton enables paraplegic athlete carry olympic flame | as one of the first testers, piette has contributed to the improvement of robotic exoskeletons, even taking part in ‘cybathlons’.",3,200
1ebss69,"breakthrough air-to-water converter works even at night, generates 20l daily",2,200
1ebtswb,"device that turns wi-fi signals into electricity created by scientists | this rectifier is designed to operate at extremely low power levels, even below -20 dbm, overcoming the limitations faced by conventional technologies.",1,200
1ec0mim,"new method turns banana waste into green textiles, energy | scientists estimate that the banana agricultural waste in pakistan could yield 57,488 million cubic meters of syngas.",1,200
1eckiyu,"mit scientists have discovered a new way to produce hydrogen fuel, using just soda cans, seawater and coffee grounds | the team says the chemical reaction could be put to work powering engines or fuel cells in marine vehicles that suck in seawater.",1,200
1ecn7jl,maglev titanium heart now whirs inside the chest of a live patient | the fully mechanical heart uses the same technology as high-speed rail lines. the feat marks a major step in keeping people alive as they wait for heart transplants.,4,200
1ecpm7k,dual action antibiotic could make bacterial resistance nearly impossible,1,200
1edesiu,"artificial blood vessels mimic human veins, offer breakthrough in heart surgery",1,200
1edhgs0,"a.i. may save us, or may construct viruses to kill us (gift article)",1,200
1ee5qot,us’ first robot-assisted dual kidney transplant performed in ohio,1,200
1ee7oxz,samsung delivers solid-state battery for evs with 600-mile range as it teases 9-minute charging and 20-year lifespan tech,4,200
1eekj1a,mit robot gently peels squash with one hand while holding it by other,3,200
1eevlre,"new wearable tech could help track ptsd, sepsis early through nerve activity | this technology could enable doctors to pinpoint patients who are at increased risk of excessive immune responses or immunoparalysis.",1,200
1eex81h,oak ridge sets a new record for wireless ev charging​ | ornl's zippy prototype delivered 270 kilowatts to a porsche taycan,2,200
1eezhwy,uk scientists achieve unprecedented 402 tbps data transmission over optical fiber | they broke their own 319 tbps record set in march,1,200
1efrmdm,"cat poo parasites could cure disorders like alzheimer’s, parkinson’s | engineered toxoplasma gondii successfully delivered therapeutic proteins to brain cells, marking a significant breakthrough in overcoming the blood-brain barrier.",1,200
1efsgry,us scientists master control of hypersonic jet engine with light-based tech,1,200
1egl5s7,"drought buster: solar tech extracts 3 liters of water from thin air daily | the design improves material flow and energy use, producing 0.65 l/m²/hr of freshwater under sunlight and 90% humidity.",1,200
1egln6i,scientists create living mosquito repellent from human skin bacteria | new bacteria design reduces mosquito attraction by up to 64.4% and lasts over a week.,3,200
1ehf9ml,construction of us’ first fourth-gen nuclear reactor ‘hermes’ begins,1,200
1ehfbyl,using 3d printing to create 3d circuits: researchers unlock self-healing boards | a singapore team has developed a novel 3d printing technique for three-dimensional circuits,3,200
1ei7oln,3d-printed ceramic ink removes “forever chemicals” from water,4,200
1ei7tm3,neuralink rival synchron syncs apple vision pro to paralyzed patient’s thoughts,0,200
1eib6l9,"219,000 kwh: norway deploys world’s largest vertical rooftop solar on soccer field | vertical solar panels generate 20-30 percent higher specific yield by the company’s own estimates.",4,200
1ej0mt0,nuclear reactor breakthrough: new material can replace costly nickel alloys,1,200
1ej65wo,"world’s first 18650 potassium-ion battery debuts, can replace lithium cells | the 18650 format, being the most widely used and designed cell format, ensures compatibility with existing devices and applications.",1,200
1ejk6en,fully-automatic robot dentist performs world's first human procedure,1,200
1ejou2g,watch: vacuum-footed robot dog cleans up the beach,4,200
1ejt40y,flash recycling breakthrough achieves 98% efficiency in battery recovery,1,200
1ekjr32,engineers use wood pulp to 3d-print stronger concrete for construction | cellulose nanofibrils (cnf) could potentially revolutionize 3d-printed concrete.,1,200
1ekm1r5,"oxford dynamics’ robot can endure nuclear incidents, even fatal radiation",1,200
1ekm20z,"cheap heat-storing 'firebricks' projected to save industries trillions | researchers predict that firebricks could reduce global reliance on batteries by 14.5%, hydrogen by 31%, and underground heat storage by 27.3% — if the world switches to full renewable energy by 2050.",2,200
1el8i7c,phys.org: physicists develop new method to combine conventional internet with the quantum internet,1,200
1elc401,"nezha-seadart: china tests air-sea hybrid drone with flight, dive capabilities | nezha-seadart can vertically take off, land from ground and water, and cruise in the air with lift generated by the wings.",0,200
1elev2v,"soft gold electrode helps nerves to connect with electronics | the soft gold wires stretch along with the body’s movements, without poking or damaging surrounding tissues.",0,200
1elfq61,"1st-ever quantum, classical internet merger achieved via single optical fiber | this novel quantum experiment has the potential to advance telecommunications.",1,200
1elg4ai,new biomaterial regrows cartilage; could prevent knee replacement surgery,3,200
1eljznm,new fuel cell achieves 60% electrical efficiency with 100% hydrogen | the solid oxide fuel cell (sofc) platform can now generate electricity with an incredible 60% efficiency when using 100% hydrogen.,2,200
1elxcfe,new canine knee implant developed by texas university to treat pet’s injury | the rev knee method begins by uploading ct scans of a knee joint into software that recreates the patient’s unique tibial and femoral components.,2,200
1em91cv,potential vaccine and treatment developed for flu and coronaviruses | team develops two nasal sprays – an immune activator and a new vaccine – to prevent virus transmission.,3,200
1em9uct,world’s 1st ai-powered hearing aids boost speech understanding by 53 times,3,200
1em9xsv,"this innovative device allows south american paleontologists to share fossils with the world. paleoscan offers scientists at far-flung institutions a less expensive way to digitize their collections and preserve at-risk specimens of fish, turtles, pterosaurs and more.",4,200
1emaxir,"sandwich to star power: mayonnaise may unlock ‘never unstable’ nuclear fusion | although mayonnaise typically behaves as a solid, when subjected to a pressure gradient, it begins to flow in a manner similar to plasma under comparable conditions.",4,200
1emcybo,could this new drug turn back the clock on multiple sclerosis?,1,200
1emfrjt,soft robotic glove returns gripping power to weakened hands,4,200
1en2ld6,"water-powered, electronics-free bandage heals chronic wounds 30% faster | when applied to a wound, a drop of water activates the battery, creating an electric field that promotes healing for several hours.",3,200
1en43aa,"world’s largest, 78 kwp floating solar plant powers paris olympic village",3,200
1en9ajl,nissan has demonstrated a new automotive paint that can drastically cool a vehicle parked in direct sunshine | tests have shown that treated cars stay up to 21.6 °f (12 °c) cooler than untreated cars parked side by side.,4,200
1enmwg3,"new lensless fluorescence microbial detection system to save millions of lives | a more efficient, low-cost system to help detect microbes in water quickly and easily, could help save millions of lives yearly in developing countries.",1,200
1enwq8v,japan adds co2 to old-school debris to create stronger concrete bricks | these new concrete blocks are strong enough to build houses and pavements.,1,200
1eo04j9,figure says its new humanoid robot can chat and learn from its mistakes,1,200
1eo2zgz,sandisk announces the world’s first 8tb sd card – the biggest memory card we’ve ever seen,3,200
1eo52ib,"‘printable’ perovskite solar cells achieve 26% efficiency, 20-year lifespan | the other major benefit is that these new generation perovskite solar cells can be printed at very low room temperatures.",1,200
1eoqlr3,new 3d printer ink makes recyclable electric circuits without heat or light | researchers from the us and korea have developed a new 3d printable ink that solidifies in salt water and is easily recyclable using just fresh water,1,200
1eose29,world’s first fusion ignition breakthrough: us firm wins esteemed award,1,200
1eox68e,breakthrough flexible solar panels are so thin they can be printed on any surface – even backpacks | a coating that's just 1 micron thick can be applied to almost any surface,1,200
1epclyw,"robots can now train themselves with new ""practice makes perfect"" algorithm",1,200
1epiona,boost ev safety with one spray: breakthrough coating enhances battery protection,1,200
1epwhz7,"how a monk and a hippo, a solar-powered waste-collection vessel, joined forces to tackle bangkok’s plastic pollution.",0,200
1epwsa1,"this futuristic space habitat is designed to self-assemble in orbit. the structure can be carried into space compactly, potentially lowering launch costs.",0,200
1eq9gtw,"scientists hail ‘smart’ insulin that responds to changing blood sugar levels in real time | people with type 1 diabetes may in future only need to give themselves insulin once a week, say experts",4,200
1eqar5t,"cern’s breakthrough experiment captures high-energy neutrinos for first time | the team analyzed a subset of the exposed detector volume, equivalent to 128.6 kg, focusing on high-energy neutrinos produced by lhc’s proton-proton collisions.",4,200
1eqch5s,china’s new blood test achieves 90% accuracy in early gastric cancer detection,1,200
1er4qjl,"rice’s ‘revolutionary’ reactor turns wastewater into green ammonia, drinking water | this breakthrough in electrochemical synthesis offers a sustainable alternative to traditional ammonia production methods.",3,200
1er4sns,"world’s 1st carbon removal facility to capture 30,000 tons of co2 over decade | also canada’s first commercial direct air capture project, deep sky’s carbon removal innovations facility aims to capture 3,000 tons of co2 per year.",4,200
1er603g,new glucose-responsive insulin may cut injection frequency to once a week,4,200
1eriq9h,"ai predicts diseases with 98% accuracy in real-time using tongue color | ai-powered computer model to analyze patients’ tongue colors for real-time disease diagnoses such as anemia, covid-19, vascular and gastrointestinal issues, or asthma.",3,200
1erze5z,martian ears: scientists develop sound system to track wind speeds on mars,1,200
1esr8gx,"new brain tech turns paralyzed patient’s thoughts into speech with 97% accuracy | this innovation deciphers brain signals when a person attempts to speak, converting them into text, which the computer then vocalizes.",1,200
1et4qkt,mit’s new ai-driven brain mapping platform sparks hope for alzheimer’s treatment,2,200
1etkr9e,"thin metal oxide films printed at room temperature can transform display tech | the films are transparent and highly conductive, thus valuable for applications such as touch screens and display technologies.",3,200
1etkryn,"researchers develop fabric that generates electricity from body heat | the fabric offers possibilities for health checks, and activity tracking.",4,200
1etnx0c,"new air-powered computer fights device failure, cuts stroke, blood clot risk",1,200
1etqevq,"us: world’s largest 8,500 mwh capacity battery to be built in maine | the project will use iron-air batteries that are easier to build, maintain and also recycle at the end of their life.",1,200
1eufg65,from pebbles to power: the rise of potassium silicate batteries,1,200
1ev6bsu,"flying robot can navigate collapsed structures easily, aid disaster response | hovering six feet up, drones convert 3d lidar data into a 2d map, analyzing pixels to identify doors and rooms.",0,200
1ev8d44,"clean lithium extraction possible with new zero-water, zero-chemical method",1,200
1evzc27,spit to save lives: 15-minute saliva test detects heart failure at home,0,200
1evzip1,"scientists use light to expand implants, reducing child heart surgeries | blue light has enough energy to start the reaction while remaining safe for living tissues.",1,200
1ew1fjc,"gps-free navigation nears reality with quantum technology breakthrough | integrated photonic chips enable compact, low-cost quantum navigation",1,200
1ew2hip,unitree g1 humanoid robot ready to leap into mass production,2,200
1ewmk8x,solar panel recyclers pioneer new methods for greening the industry,1,200
1ewsdc3,"printed electronics with 1,000 times more charge could detect spoiled milk, food | the printed electronics can be used to scan everyday objects—for example, milk cartons and fridges—to enable communication between these objects and smartphones and computers.",0,200
1ewtadv,plastic pollution solution: scientists develop green plastic alternative,4,200
1ewutmz,light-activated implant could spare babies from multiple heart surgeries,4,200
1ewuvxw,continuous flow reactor recycles many common plastics | aduro's water-based process could address growing plastic waste,3,200
1ewyobq,brainwave-reading robot ‘coaches’ could rehabilitate stroke survivors | a new system allows rehabilitation robots to read brainwaves using a brain-computer interface headset.,1,200
1ex6ygh,new bacteria-derived hydrogel effective in muscle tissue regeneration | a groundbreaking study in regenerative medicine: researchers manufactured a hydrogel out of bacteria that stimulates muscle repair.,4,200
1exmlee,"salsa hack: 50% recycled glass mix boosts cilantro, pepper, jalapeño plant growth | preliminary results suggest that recycled glass not only accelerates plant growth but also prevents fungal growth.",0,200
1exn9r3,unique ‘heart-in-a-box’ tech keeps donated organ beating for 9 hrs,4,200
1eyef97,world's fastest microscope freezes time at 1 quintillionth of a second | physicists at the university of arizona have developed the world’s fastest electron microscope to capture events lasting just one quintillionth of a second.,2,200
1eygkaa,‘natural cement’: scientists electrocute sand to stop coastline erosion | calculations estimate that the cost of electrically cementing one cubic meter of ground ranges from $3 to $6.,0,200
1eyglsu,"‘world’s fastest’ microscope captures electron motion in striking detail | the researchers generated a single attosecond electron pulse to capture an electron in a fixed state, matching the speed at which electrons move.",3,200
1eyhmwu,"lotus-inspired reactor turns carbon emissions into useful chemicals, fuel",0,200
1eyveyh,"new nanogenerators achieve 140-fold power density gain, could rival solar cells | if a traditional nanogenerator produces ten milliwatts of power, this new technology could increase that output to over 1,000 milliwatts.",1,200
1ez8rbn,"sprayable safety: stanford engineers wildfire-shielding gel to protect homes | the innovative gel transforms into a silica-based aerogel under heat, providing superior insulation and protection.",0,200
1ezbga6,67-year-old receives world-first lung cancer vaccine as human trials begin,2,200
1ezv07u,"eco-friendly ""living plastic"" contains the seeds of its own destruction",0,200
1ezxdja,swarmbotics founders grew 'obsessed with robot swarms' and now plan to bring them to the battlefield,4,200
1f02vpy,"mit develops low-cost, high-energy batteries using disordered rock salt cathodes |  the new material family primarily comprises manganese, an earth-abundant element less expensive than nickel and cobalt.",1,200
1f049yo,lotus leaf-inspired tech advances 3d nanoscale tumor study,2,200
1f0utuf,"us achieves superconductor breakthrough, can benefit quantum computing",1,200
1f16dw7,"bacteria helping to extract rare metals from old batteries in boost for green tech | team at university of edinburgh using microbes to recycle lithium, cobalt and other expensive minerals",2,200
1f1lpu5,"new ev battery transforms waste energy into power for extended range | deogam is currently field-testing their innovative battery in 500 hyundai ioniq 5 taxis on jeju island, south korea.",1,200
1f1mel1,artificial sun: nuclear fusion closer to reality with this new method,1,200
1f1mgoi,how do you 3d print glass? precisely shaped glass is a tricky substance for additive manufacturing,0,200
1f1qbna,tiny might: nanoparticles with huge surface area created to capture carbon | the nanoparticles could be used to curb emissions from various industries including cement and metals.,4,200
1f1qmlm,new laser could cram gps alternative into a shoebox | cold-atom interferometers' precise navigation is hampered by size and cost,3,200
1f2d32v,"tiny 8mm mind-reading chip turns thoughts into text with 91% accuracy | by converting thoughts into text, the mibmi offers a revolutionary communication tool for people with severe motor disabilities.",0,200
1f2d3lt,"japan’s manganese-boosted ev battery hits game-changing 820 wh/kg, no decay | manganese anodes in li-ion batteries achieved 820 wh/kg, surpassing nico batteries’ 750 wh/kg.",4,200
1f2g9s1,h2starfire: new hydrogen engine boasts 60% efficien,2,200
1f37b0t,"no glue required: wood and metal bonded with sound and 3d printing | the two methods create super strong bonds at the pore level, eliminating the need for caustic adhesives.",0,200
1f37d91,"china scientists’ breakthrough flow battery hits 850 cycles, retains 99.95% capacity | with new organic molecules, the organic flow battery performed well for 600 cycles without a drop in capacity.",1,200
1f39h04,"new wood-based material captures, releases co2 on demand",1,200
1f3ybqz,injectable pacemaker regulates heartbeat for 5 days then dissolves,0,200
1f3ye3p,"blood glucose affects voice pitch, with potential for diabetes monitoring",3,200
1f405uc,"4-hour power: world’s 1st 62-mile-range hydrogen-powered drone soars in china | the drone weighs around 42 pounds (19kg), carries up to 13 pounds (6kg), flies for over 4 hours, and boasts industry-leading performance and design.",4,200
1f42amw,every second counts: new blood test detects brain cancer in an hour,1,200
1f47r05,"new device listens for blood pressure | ultrasound monitoring allows for continuous, non-invasive measurements",1,200
1f4qhs4,"low cost ‘smart mask’ can detect disease from breath, researchers say | hopes that device may improve diagnosis and monitoring of conditions such as lung and kidney disease",4,200
1f4u3en,"eth unveils iron-based hydrogen storage that’s 10x cheaper, safer",0,200
1f4ulwr,new method turns plastic waste into valuable resources with vaporizing process | the new catalysts simplify the process by eliminating the need for a previously crucial step: removing hydrogen to create breakable points in the plastic’s structure.,3,200
1f585kx,the world’s fastest microscope captures electrons down to the attosecond,3,200
1f5kl9n,"world’s largest air-to-water heat pump to warm 30,000 homes in finland | the heat pump will supply 200 gwh of energy annually and help save 26,000 tonnes of carbon emissions.",4,200
1f5mjyd,heart simulator with nanoparticles can temporarily correct arrhythmia,0,200
1f5w5l2,researchers unlock cheap way to vaporize plastic and use it to make more plastic | the breakthrough enables a circular economy where plastic doesn't end up sitting in landfills,1,200
1f6aztx,"fungus learns to drive in ""biohybrid"" robots | a new kind of “biohybrid” robot moves in response to signals from the nervous system of a fungus.",1,200
1f6bw4x,"highly efficient perovskite nanocrystals to help develop next-gen ultra-hd leds | perovskites aren’t just limited to solar cells, they have the potential to provide the world with the best light emitters and displays ever witnessed.",4,200
1f6ebgv,new fusion reactor design promises unprecedented plasma stability,4,200
1f75zho,"new hydrogel ‘invention’ could slow, treat arthritis in early stages, claims china | this breakthrough development brings hope for millions of people suffering from osteoarthritis.",1,200
1f7sdla,exploring peptide clumping for improved drug and material solutions,2,200
1f7vzho,"sweat-powered finger wrap tracks glucose, vitamins, drug levels in your body | the device operates using biofuel cells positioned where it contacts the fingertip, which efficiently collect and convert chemicals in sweat into electricity.",1,200
1f7y4jv,us firm plans santa-like spaceplane launches with rocket-powered sled,4,200
1f7yhxc,uk aims for nuclear power breakthrough with ‘world-leading’ reactor design | step will aim to demonstrate net energy from fusion and pave the way for the commercialization of fusion energy.,1,200
1f8h8x0,"world’s 1st platinum-magnesium fuel cell catalyst unveiled, to boost efficiency | scientists say the new fuel cell catalyst made from platinum and magnesium delivers exceptional efficiency and durability, potentially transforming clean energy technology.",1,200
1f8qmx0,sensor-powered pen transforms braille into english text with 84.5% accuracy | the device’s real-time algorithm and tactile sensors make it a promising tool for learning and using braille.,3,200
1f8vmp0,prototype quantum processor hits record 99.9% qubit fidelity in a major milestone | the achievement marks a way toward “fault-tolerant” quantum computing.,1,200
1f9jqt9,us aims new water-based battery to power gird-scale energy storage,1,200
1f9jubc,world’s 1st petahertz-frequency mixer advances ultra-fast communication tech | petahertz-frequency mixers would enable the transmission and processing of vastly larger amounts of information at many times higher speeds.,3,200
1f9tzvi,how the marine corps is testing a ‘narco-boat’ for resupply efforts,0,200
1fa1twv,scientists use food dye found in doritos to make see-through mice,1,200
1fabf6p,"mit’s new silk-cellulose water filter blocks stubborn forever chemicals, metals | the new silk-cellulose filter outperforms traditional materials in removing contaminants, with strong antimicrobial properties that prevent fouling.",3,200
1facruk,low-cost epr sensor on chip to boost quality control of food products,0,200
1faenle,"shapeshifting aircraft could be possible with new alloy that stretches 20 times | shape-shifting aircraft have remained a part of science-fiction for decades, not any more.",2,200
1fb4usb,us nuclear reactor breakthrough unravels plutonium oxide’s secrets at 3000 k | the research team employed an innovative method by suspending small samples of puo2 in a gas stream and then heating them with a laser.,1,200
1fbw0s6,"'modular' approach can help connect, control millions of qubits",0,200
1fcmmnx,china-us team creates plant-based nanoparticles to fight deadliest brain cancer | these nanoparticles are designed to penetrate the blood-brain barrier and target tumor cells directly.,1,200
1fcn9ma,"new muscle-powered robot leg promises more speed, energy savings",1,200
1fcpa68,"doctors have successfully operated on a pig – from 5,780 miles away | using a video game controller, surgeons in switzerland successfully performed an endoscopy on a pig in hong kong, paving the way for remote procedures in humans in areas where local expertise isn’t available.",3,200
1fd7dfi,newly discovered antibody protects against all covid-19 variants,0,200
1fde42d,"first-ever 3d metal printing in space achieved on iss | built with airbus, the metal 3d printer completed the first of four test shapes.",0,200
1fde58y,"japan starts removing melted nuclear fuel 13 years after fukushima disaster  | advanced robotic technology, including a fishing rod-like arm, is being used to extract hazardous material from fukushima’s reactors amid high radiation levels.",3,200
1fdfytm,princeton researchers bend dna strands with light to probe the genome,3,200
1fdh122,"new filtration material could remove long-lasting chemicals from water membranes based on natural silk and cellulose can remove many contaminants, including “forever chemicals” and heavy metals.",1,200
1fdj8bd,wireless system wavecore penetrates concrete walls without drilling | the system achieved a 4 gbps connection through a 12-inch concrete wall,1,200
1fe638g,why you should always be wary of insider threats: a disgruntled employee at a us industrial firm deleted backups and locked it admins out of workstations in a failed data extortion attempt,0,200
1fe85uv,polaris’ new mira prototype to fly with world’s 1st aerospike engine,1,200
1fe9ln0,"world’s strongest battery could extend ev range by 70%, make phones credit card-thin | the structural battery uses carbon fiber for its electrodes negating need for copper or aluminum, which add weight.",1,200
1ff0cht,new sugar-based polymer could help remove heavy metals from water,1,200
