id,title,cluster,bins
1gqdnyv,beetle-inspired robots roll objects with new neural control system,1,200
1gr3dkv,"fatbergs fighter: new self-healing zinc coating cuts sewer clogging by 30% | in lab tests, the coated concrete showed a 30% reduction in fat, oil, and grease buildup.",2,200
1gr5pai,new microreactor converts co2 to methanol with renewable energy,1,200
1grv3rt,"finland’s 100mw sand battery turns 2,000 tons of fireplace waste into power | in terms of size, this unique battery will have a height of about 13 meters and a width of roughly 15 meters.",1,200
1grwr8n,wave-busting tech from edinburgh keeps robots steady in stormy waters,1,200
1gsnsd2,electro-biodiesel: scientists make 45x more efficient fuel from co2,1,200
1gte1hg,iter receives hyundai-made vacuum vessel to house nuclear reactions,2,200
1gti13c,scientists make first mechanical qubit,1,200
1gu4lnm,"china’s 3 gw solar plant with nearly 6,000,000 panels to power millions of homes | with nearly 6 million panels, the project will prevent release of 4.7 million tons of co2 every year.",3,200
1gu5599,robot dog bert moves faster using new energy-efficient movement tech,1,200
1gudeus,"revolutionary membrane tech separates 97% oil from water with 99.9% purity | researchers in china have unveiled a new, highly effective technique for separating oil and water mixtures.",1,200
1guwcq8,tethered robots could turn moon’s lava tubes into future astronaut homes | the researchers put this system to the test in the harsh volcanic landscapes of lanzarote island in the atlantic ocean.,1,200
1guxo1z,mit spinout uses engines to turn trash gas into green fuel factories,4,200
1guz7z1,422-million-year-old ancient animal cell helps scientists create a mouse | the team uncovered that choanoflagellates possess versions of the sox and pou genes—key drivers of pluripotency.,3,200
1gv7sdh,"niantic uses pokémon go player data to build ai navigation system. visual scans of the world have helped niantic build what it calls a ""large geospatial model.""",1,200
1gve1wk,scientists identify tomato genes to tweak for sweeter fruit,4,200
1gvnw6q,"new 3d bioprinter could build replicas of human organs, offering a boost for drug discovery | the invention uses light, sound and bubbles to quickly create copies of soft tissue that might one day support testing individualized therapies for cancer and other diseases",1,200
1gvpxi0,"uk scientists extend solar cell life by stunning 66%, boost efficiency by 23% | to enhance the performance of lead-tin perovskite cells, the team investigated the role of the hole transport layer, a crucial component in solar cell function.",1,200
1gvq5j4,princeton achieves 10x reduction in tritium needs for nuclear fusion,3,200
1gvqhog,microsoft and atom computing combine for quantum error correction demo,4,200
1gwek8q,no more injections: mit develop capsule that delivers drugs straight to the gut | this capsule is designed to release drugs directly into the stomach wall or other organs in the digestive tract.,0,200
1gwgrar,space-age material to boost next-gen modular nuclear fusion reactors,1,200
1gwia4j,chemists use light to break down pfas at room temperature | chemists have illustrated how an led light-based photocatalytic system can break the carbon-fluorine bonds in pfas.,3,200
1gx581m,"us deploys first-ever autonomous robotic cameras in stratosphere nationwide | the swift robots offer enhanced resolution capabilities of 7 centimeters, which match or surpass traditional aerial survey quality.",4,200
1gx7iyv,"bite of hope: malaria vaccine delivered by gene-edited mosquito kills infection by 89% | this technique gave the immune system a powerful boost, shielding people from the disease.",2,200
1gx8c5v,"new solar cell coating triples efficiency, stability, conversion rate",1,200
1gxmqb6,us deploys first-ever autonomous robotic cameras in stratosphere nationwide,3,200
1gxy33o,"this new, yellow powder quickly pulls carbon dioxide from the air. scientists say just 200 grams of the porous material, known as a covalent organic framework, is called cof-999, could capture 44 pounds of the greenhouse gas per year—the same as a large tree",1,200
1gxzucv,new heat-to-electricity tech beats battery storage with 60% efficiency,1,200
1gyr6gl,"""... jet engines shouldn’t be possible"" “the air coming in is hotter than the melting point of the metal underneath... to get around this problem heat-resistant ceramic coatings are applied to the engine blades. now researchers are developing stronger coatings allowing the engines to run even hotter",2,200
1gyukb6,"a reaction that only measured protons detected neutrons for the first time | for the last 10 years, scientists have been working on a neutron detector. finally, they tested it, and it worked like magic.",2,200
1gzh4xb,"engineers turn rotten seaweed into car fuel, aim to cut 14 million-ton of co2 | seaweed is showing up on caribbean beaches and cleaning up costs are in millions of dollars. but this waste can be turned into precious fuels.",0,200
1gzjrst,"boom supersonic xb-1 jet hits 25,040 feet in record-setting flight",0,200
1h0c9tj,"to design better water filters, mit engineers look to manta rays. new research shows the filter-feeders strike a natural balance between permeability and selectivity that could inform design of water treatment systems.",1,200
1h0cre8,scientists use sunlight to break the toughest plastic to recycle,1,200
1h12sn1,researchers develop rare earth-free high power electric motors using copper | using copper coils instead of rare earth materials in the motor’s rotating part is much more accessible.,1,200
1h14xgc,japan’s superalloys withstand 1112°f test to protect nuclear fusion reactors,2,200
1h1u9dd,"gold-based drug slows cancer tumor growth by 82%, outperforms chemotherapy | gold’s unique properties make it ideal for medical applications, as it is highly stable and unreactive, which also explains its common use in jewelry and coins.",1,200
1h1w4xn,"robot balloons soar 85,000 ft, map nyc-sized areas with 0 emissions",3,200
1h2mxra,korea’s artificial sun switched on to target tungsten impurities,0,200
1h3dnxy,uk unveils world's 1st ai-designed urban wind turbine with 7x efficiency,3,200
1h444kn,world first: scientists convert heat into electricity using tungsten disilicide,1,200
1h4ujrh,plasma compression breakthrough: general fusion hits 600 million neutrons per second | general fusion demonstrated the viability of a stable fusion process using its mtf approach.,4,200
1h4vl96,"scientists make wood glow with 2,400-year-old honey fungus in a scientific adventure | the biohybrid of fungus and wood, developed in the lab, produces green light after being incubated for three months, with plans to increase its luminosity further.",4,200
1h4vn07,"world’s largest co2 heat pump with 70mw capacity begins operation to power 25,000 homes",3,200
1h4zvjw,interestingengineering has been banned,0,200
1h5ng2l,ai dash cams give wake-up calls to drowsy drivers | innovative tech detects driver fatigue and signals them to take a break,2,200
1h5qkfp,electronic ‘tattoos’ offer an alternative to electrodes for brain monitoring | a spray-on ink detects electrical activity in the brain for hours,4,200
1h66avu,licking this “lollipop” will let you taste virtual flavors,0,200
1h6fl9r,"a new catalyst can turn methane into something useful. mit chemical engineers have devised a way to capture methane, a potent greenhouse gas, and convert it into polymers.",4,200
1h6gurk,refurbished heart pacemakers work like new,4,200
1h6y0td,"robot cat that sticks landing may revolutionise asteroid mining, scientists say",1,200
1h78m56,prenatal test accidentally picks up cancer in 50% of those with wonky results | the prenatal test results flagged cancers when other screens and tests missed it.,2,200
1h78or2,billions of people to benefit from technology breakthrough that ensures freshwater for the world,1,200
1h792n3,"carpet fibres stop concrete cracking. engineers in australia have found a way to make stronger and crack-resistant concrete with scrap carpet fibres, rolling out the red carpet for sustainability in the construction sector.",1,200
1h7qdkm,'breakthrough' dementia drug looks to stop disease in its tracks,4,200
1h8130c,two european satellites launch on mission to blot out the sun—for science,0,200
1h815us,burned rice hulls could help batteries store more charge,1,200
1h8350t,"scientists develop battery with 5,000+ year lifespan by encasing radioactive carbon in diamond | it could power electronics aboard space probes for centuries, among other things",1,200
1h8fwm0,virtual lab powered by ‘ai scientists’ super-charges biomedical research,4,200
1h8s83b,researchers claim record-breaking 25.7% efficency for perovskite-organic tandem solar cell,1,200
1h8tarx,"drones with legs can walk, hop, and jump into the air",0,200
1h98sb7,"the art of failure analysis. searching for defects in their chips, these engineers found something inspiring.",0,200
1h9jtac,"""world's simplest"" nuclear reactors could be installed underground to provide heat to cities",1,200
1h9jyfw,temporary scalp e-tattoos that scan brain could replace traditional eegs forever,1,200
1h9p8h3,"scientists discover new way to make fuel from water and sunlight, but more work is needed",1,200
1ha8fsu,"brain stimulation helps people ​walk after spinal injury | researchers created a ""brain atlas"" to find the right spot for electrodes",1,200
1ha9xig,crop parasites can be deterred by “electric fences” a pesticide-free technique holds promise by scrambling protists’ senses,0,200
1hb24op,sionic energy unveils 100-percent silicon anode battery,1,200
1hbirv1,ferroelectric devices could make iot data unhackable. fefet array enables homomorphic encryption in battery-powered devices.,3,200
1hbnqfg,"nvidia, rigetti, quantum machines deliver ai-powered quantum computing",1,200
1hbtd03,ai is driving india’s next agricultural revolution,3,200
1hbuf8o,google gets an error-corrected quantum bit to be stable for an hour,2,200
1hbug93,transforming fusion from a scientific curiosity into a powerful clean energy source,4,200
1hcj85x,"fish-inspired sensor ""touches"" using electric fields | a synthetic e-skin uses capacitance to detect nearby objects",4,200
1hcl9co,graphene interconnects to moore's law's rescue,0,200
1hclrpw,"scientists have accidentally discovered a particle that has mass when it’s traveling in one direction, but no mass while traveling in a different direction | known as semi-dirac fermions, particles with this bizarre behavior were first predicted 16 years ago.",4,200
1hdai04,new tongue-stimulating implant offers hope to millions with sleep apnoea in uk first | nyxoah’s genio device zaps the nerves in the tongue to help sufferers breathe better overnight,1,200
1hdco1q,award-winning tech uses cyborg mollusks to monitor water pollution,1,200
1hdnl19,"nvidia, amd, and intel invest in ayar labs to enable futuristic light-based chips",0,200
1he2dzd,new invention harvests static energy from waste polystyrene to produce electricity,1,200
1he3w1t,"noninvasive imaging method can penetrate deeper into living tissue. using high-powered lasers, this new method could help biologists study the body’s immune responses and develop new medicines.",1,200
1he6r00,new retrofit lets micro-turbines burn both hydrogen and natural gas,2,200
1het2r9,"shape-shifting antenna takes cue from ""the expanse"" inspired by the sci-fi show, the device morphs to suit its signals",4,200
1het4ww,"magnetic ""metasheet"" material moves objects like a conveyor belt",3,200
1hez16g,researchers have developed a new device which will enable small drones to shoot powerful lasers – something once thought impossible,1,200
1hfj8vj,optical fibers monitor brain for deadly post-injury complications,3,200
1hfk2a2,physicists uncover new state of matter called quantum spin liquid | this discovery could open doors for further discoveries in fundamental and quantum physics.,1,200
1hg83wx,"""crazy li"" arms drones with powerful lasers that can cut through metal",0,200
1hgancg,nuclear-electric rocket propulsion could cut mars round-trips down to a few months,4,200
1hh0628,"an innovative fertility technology using stem cells to help an embryo mature outside the body has resulted in the world’s first live human birth | gameto, the company that developed the approach, says it’s faster, safer and more accessible than conventional ivf.",1,200
1hh1izr,cyborg cockroach armies can now be mass-produced at a rate of one every 68 seconds,0,200
1hhr8q6,"squid-based biodegradable sponge removes 99.9% of microplastics from water | the new sponge method is promising, but challenges such as properly disposing of absorbed microplastics remain a critical issue.",4,200
1hhyvda,biologically inspired bioactive hydrogels for scarless corneal repair,0,200
1hiiaj3,billion times faster chip-based laser neuron can process 34.7 million images per second | the researchers have created chip-based quantum-dot laser-graded neurons.,4,200
1hiicdb,"miniature vr headset to immerse mice in virtual environments to reveal neural activity | the researchers are looking to further develop the goggles, with a lightweight, mobile version for larger rodents.",4,200
1hikehr,chiral flat-band optical cavity with atomically thin mirrors,0,200
1hioquf,"new physics sim trains robots 430,000 times faster than reality | ""genesis"" can compress training times from decades into hours using 3d worlds conjured from text.",1,200
1hj9sa6,a football field in a teaspoon: new material has insane surface area,1,200
1hjkbj3,cern's large hadron collider finds the heaviest antimatter particle yet | hyperhelium-4 now has an antimatter counterpart,0,200
1hjyjq9,'absolute miracle' breakthrough provides recipe for zero-carbon cement,4,200
1hjzcjn,green sea turtle gets relief from “bubble butt” syndrome thanks to 3d printing,0,200
1hk6ua5,tetsuwan scientific is making robotic ai scientists that can run experiments on their own,1,200
1hkm4wo,"desert ant vision powers sci-fi style super chip to spot cancer, boost security | chinese researchers have developed a miniature, on-chip polarization photodetector.",2,200
1hkm88w,"scientists develop matchbox-sized laser in a bid to boost quantum research | the affordable, lightweight 780nm laser can perform on par with typical tabletop lasers and can be used both inside and outside the lab, according to the researchers.",4,200
1hkmh5n,"engineers achieve quantum teleportation over active internet cables | as research advances, we could enter a new era in communication technology, where quantum and traditional networks can coexist to offer unprecedented levels of security and speed.",1,200
1hkn6tk,transparent bamboo: a fireproof and waterproof alternative to glass,0,200
1hlddah,iron man-inspired exoskeleton helps paraplegics walk again,0,200
1hldpy7,will even the most advanced subs have nowhere to hide? the scramble to preserve submarine stealth in an age of ai and all-seeing sensors,4,200
1hm0ife,mit's light-activated antiferromagnetic memory could replace today's ferromagnets,3,200
1hm13re,"a bionic leg controlled by the brain. a new kind of prosthetic limb depends on carbon fibre and computer chips—and the reëngineering of muscles, tendons, and bone.",2,200
1hmd9zy,f1 stalwart is quietly innovating to bring its expertise in cooling to data centers and beyond | castrol is developing dielectric fluids for immersion cooling systems,0,200
1hmm40v,"the british army is trialing radio waves to zap drones out of the sky – at 13 cents per shot | the system disrupt drones from over a kilometer away, essentially shooting them down",4,200
1hmnkkb,twisted light: the edison bulb has purpose again,0,200
1hms3kr,swarms of tiny robots coordinate to achieve ant-like feats of strength,1,200
1hndqih,"stem cells from mice have been 'instructed' to form specific tissues and organs | researchers can guide and control the development of stem cells into specific tissues and organs, opening the door to developing a means of one day tackling complex diseases like diabetes and parkinson’s disease.",4,200
1hne7v5,breakthrough treatment flips cancer cells back into normal cells,1,200
1hod1vv,"mit engineers grow “high-rise” 3d chips. an electronic stacking technique could exponentially increase the number of transistors on chips, enabling more efficient ai hardware.",2,200
1howzkh,scientists built tiny vr goggles for mice,4,200
1hozms8,five breakthroughs that make openai’s o3 a turning point for ai — and one big challenge,3,200
1hplzo7,"mit team decodes quantum geometry in kagome metal for the first time | we know a lot about electrons in terms of their energy, nature, and movement. however, their quantum geometry has remained a puzzle.",1,200
1hpnbb9,how hallucinatory a.i. helps science dream up big breakthroughs,4,200
1hpnhv8,"anti-aging treat: dog drug could extend human lifespan, us scientists explore | the us-based company believes their research on canine longevity will also benefit humans.",1,200
1hpwd6c,"in a first, surgical robots learned tasks by watching videos | robots have been trained to perform surgical tasks with the skill of human doctors, even learning to correct their own mistakes during surgeries.",1,200
1hqe9k9,remote-controlled gene therapy uses ultrasound to kill cancer,1,200
1hr385t,manta rays inspire faster swimming robots and better water filters,1,200
1hrorwc,"a colossal 18,000kg ev is autonomously loading gold at a canadian mine, with a high-performance 540 kw electric drivetrain and a massive battery",4,200
1hrt4mj,"clever armadillo-inspired ""fabric"" gets stiff or soft as needed",0,200
1hrtc3n,"system to auto-detect new variants will inform better response to future infectious disease outbreaks | researchers found a new way to identify more infectious variants of viruses or bacteria that start spreading in humans - including the flu, covid, whooping cough and tuberculosis.",1,200
1hsl46v,"new ultrasound tech could be used to 3d-print implants inside the body | in order to keep surgeries minimally invasive, it would be great if implants could be injected into the body in liquid form, then solidified once in place.",1,200
1hsobi1,scientists extract gold from e-waste to transform co2 into valuable chemicals | the team’s innovation recovers gold from discarded electronics and uses it as a catalyst to transform co2 into useful organic materials.,4,200
1ht66c2,"injected hydrogel becomes a bone-healing solid when exposed to light | cells from the adjacent bone tissue gradually migrate into such a material, where they proceed to reproduce as the material harmlessly biodegrades.",1,200
1hte730,implants made of your blood could repair broken bone,1,200
1htwmfg,"next-gen ev batteries could last decades, researchers show the potential of single-crystal electrode tech | the battery lifespan could be around 20,000 cycles or 8 million kilometers",1,200
1hu7mov,liquid crystal glasses filter out epileptic-seizure-triggering light,0,200
1huh4zy,"robots can now walk through muddy and slippery terrain, thanks to moose-like feet",2,200
1huyvel,parkinson's disease may one day be treated with a shot of magnetic discs,0,200
1hvg2gc,"drones with legs can walk, hop, and jump into the air",0,200
1hvrnth,clever coating for medical devices stops clots by imitating a blood vessel,4,200
1hwijft,"damaged coral reefs are getting a helping robotic hand | various groups are now growing baby corals for transplantation into the world's disappearing reefs, but they need a hand. a new robotic hand has been created to help, by carefully transferring the li'l corals between tanks as they grow up.",3,200
1hwik5t,"electrochemical reactor grabs 97.5% of lithium from geothermal sources | lithium-ion batteries power everything from our vape pens to electric cars, but they have one glaring issue: they rely on lots of hard-to-harvest lithium.",3,200
1hwkkof,a dash of gallium may make for stabler hip and knee implants,4,200
1hxbyeb,australian scientists engineer ‘toxic male’ mosquitoes to combat deadly diseases | male mosquitoes are being genetically modified to produce spider and sea anemone venom.,4,200
1hxc1se,scientists develop coldest-ever fridge for quantum computers for icy upgrades | this development increases the probability of a qubit being in its ground state before computation from 99.8-99.92% to 99.97%.,4,200
1hxdbm7,genetic tweak weaponizes mosquito semen for population control,0,200
1hy2kav,"prostate cancer is usually treated with surgery and radiation therapy, but these can have drastic side effects | a new clinical trial is exploring the safety and efficacy of killing the cancer cells with a blast of steam.",1,200
1hy4uyv,'thermochromorph' art changes with the temperature,0,200
1hyvoqs,"grain-sized soft robot delivers multiple medications, guided by magnetic fields",3,200
1hzcbqa,"smart stitches generate electricity on movement for faster healing | scientists in china have now turned that weakness into a strength, developing stitches that generate an electric charge when stretched and heal wounds faster.",3,200
1i0dc54,"""functional cure"" for diabetes restores insulin production with stem cells | a patient with type 1 diabetes has been functionally cured of the disease. the treatment involves growing and transplanting new insulin-producing cells from the patient’s own stem cells.",1,200
1i0dty2,new filter captures and recycles aluminum from manufacturing waste,3,200
1i0x6yc,"ai unveils strange chip designs, while discovering new functionalities",1,200
1i14jv5,under-skin implant dispenses naloxone to prevent opioid overdose deaths | the isos (implantable system for opioid safety) implant is being developed to automatically dispenses naloxone from within the body.,0,200
1i16708,robotic sea turtle could soon be swimming in an ocean near you,4,200
1i16cgi,japan debuts first general-purpose quantum computer made of light,1,200
1i18b5h,donut lab's new motor brings power to the wheel hub | the finland-based company's in-wheel motor serves up 650 kilowatts of power,1,200
1i19pvc,scientists invent sand-powered seismic device to reduce earthquake damage by 75% | university of sharjah professors patent an earthquake dissipation device that only needs sand to withstand seismic forces.,3,200
1i1utnt,"we've never been closer to accurately assessing whether an individual is more susceptible to developing major depressive disorder due to their biology, with 293 newly identified gene variants found to play a role in ramping up the risk factor | that's 42% more than was previously known.",0,200
1i1xkwd,world's first liquid hydrogen powered turbine engine,1,200
1i2nfov,"mit’s robot bees break pollination records with 1,000-second hover, flips and more | the robot reaches 35 cm/s, performs flips, and traces paths like “m-i-t,” highlighting control and endurance advances.",2,200
1i2pf46,woven city is a real-world test bed for tomorrow's tech,2,200
1i2s4zm,device uses wind to create ammonia out of thin air | the process requires no external power to produce the green energy fuel,1,200
1i3eoao,"brain-controlled bionic hand offers most advanced artificial touch yet | the new brain-computer interface device goes ""beyond anything that has been done before,"" the researchers claim.",1,200
1i3f8ce,"21st-century chainmail uses molecular instead of metallic links | the ""highest density of mechanical bonds ever achieved,"" researchers created a flexible material that works like chainmail. the breakthrough has already demonstrated its ability to improve body armor.",1,200
1i3synh,robots the size of rice grains aim to revolutionize brain surgery | far less invasive than traditional tools,1,200
1i47blt,heart attack damage could be reversed by reactivating dormant gene,4,200
1i4an2a,"fly-eyed glasses may help the visually impaired see well again | a clever new set of glasses may offer new hope to people with macular degeneration. by copying the structure of a fly's eyes, the specs are claimed to ""fill in"" the missing section of the wearer's view of the world.",4,200
1i5qd5j,molten salt nuclear reactor in wyoming hits key milestone,4,200
1i5z4jg,a solid electrolyte gives lithium-sulfur batteries ludicrous endurance | sulfur can store a lot more lithium but is problematically reactive in batteries.,3,200
1i6h5lf,"robotic glove helps pianists boost finger speed and skill in just 30 minutes | the exoskeleton allowed each finger to move on its own, helping participants practice fast, complex finger movements they hadn’t tried before.",0,200
1i6hass,"plant-based breakthrough boosts water-based zinc batteries’ performance in cold | the breakthrough prevents freezing in water-based zinc electrolytes, improving battery efficiency in cold conditions.",1,200
1i6iffn,new fuel withstands nuclear thermal propulsion reactor conditions,1,200
1i6kuea,"world’s smallest biomedical robot could pave way for minimally invasive surgeries | at just 0.95 millimeters, it’s 60 percent smaller than any existing model.",1,200
1i78leq,"researchers have discovered that proteins in the mollusk’s blood not only have bacteria-killing properties, raising the possibility of a new antibiotic, but also increase the effectiveness of some existing antibiotics.",1,200
1i7agm7,"breakthrough plastic supercapacitor hits 70,000 charge cycles, offers 100x conductivity | “the advance could lead to supercapacitors that can meet some energy storage demands as the world transitions to renewable, sustainable energy production.”",1,200
1i7bhqs,3d-printed battery made from fungi feeds on sugars,4,200
1i82s0a,got milk? startup develops milk-based targeted drug-delivery technology,4,200
